P179		FALSE	TRUE	Pirâmide com Bolinhas III	3 peças com 20 bolas cada em madeira pinus e base triângular de madeira tipo caixeta	Testar a capacidade de raciocínio	Os blocos são compostos por junções fixas de esferas: 20 esferas soltas (1 unidade), 10 duplas, 5 trincas lineares, 3 trincas triangulares (2 tipos), 5 blocos com 4 esferas lineares (2 tipos), 6 blocos com 4 esferas (5 tipos) e 2 blocos com 6 esferas. A tarefa é usar esses blocos para montar uma pirâmide com: Base triangular de 3 esferas de lado, totalizando 20 esferas por pirâmide	Esferas, quebra-cabeça, pirâmide tetraédrica, empacotamento		https://drive.google.com/file/d/1coDR8F7wfUPbwd-WryJCEjeYcWXU3fBx/view?usp=sharing		https://photos.app.goo.gl/EPhJinbkoZb6yywV8		https://www.youtube.com/playlist?list=PLHiOaPPoa2tCXYs6wbrMtDjO00_2UnhhC	5	xxxx	Peça	Jogos e Quebra-Cabeças	Jogos e Quebra-Cabeças	xxxx	xxxx	xxxx	30 cm x 30 cm x 10 cm	10,00000	R$ 250,00	LDM
P180		FALSE	TRUE	Olhos do Dragão	Escultura tridimensional em forma de cabeça de dragão, que usa superfícies côncavas e efeitos de iluminação para gerar a ilusão de que a cabeça ou os olhos acompanham o observador.	Mostrar como a geometria das superfícies e a percepção visual interagem para criar ilusões visuais — incentivando a descoberta de que o que vemos pode não corresponder ao que há.	A peça está projetada com uma superfície que engana o cérebro humano ao perceber profundidade e forma; o visitante muda de posição e percebe o “movimento” da cabeça/olhos do dragão devido a nossa tendência perceptiva de interpretar rostos como convexos e seguir o olhar.	Ilusão óptica, máscara oca, geometria de superfícies, côncavo/convexo, profundidade perceptiva, percepção visual, arte matemática.		https://drive.google.com/file/d/1XycMtjSaHDJ_E6twYy7JzbCQg1tUzDCD/view?usp=sharing		https://photos.app.goo.gl/PtNndR1qnF4GEysv9		https://www.youtube.com/playlist?list=PLHiOaPPoa2tDbMTXGvE1jHCDdfFJj3kRf	1	xxxx	Peça	Materiais Lúdicos	Materiais Lúdicos	xxxx	xxxx	xxxx	80 cm x 100 cm x 150 cm	5,00000	R$150,00	LDM
P181		FALSE	TRUE	Garrafa de Klein	Objeto em impressão 3D (plástico vermelho vazado), representando uma superfície não orientável	Explorar propriedades da topologia e superfícies que não possuem interior ou exterior	A peça é observada e manipulada para se perceber que sua superfície é única e contínua, sem distinção entre dentro e fora	Topologia, superfície não orientável, continuidade, geometria moderna, relação com a fita de Möbius		https://drive.google.com/file/d/1Mf8UaFiuZKRZSKAUwg0dPa88mQcJsHmL/view?usp=sharing		https://photos.app.goo.gl/R3W4KRanANVgX63q8		https://www.youtube.com/playlist?list=PLHiOaPPoa2tCGCUjsCi3qTazXIRO7tj6f		xxxx	Peça	Geometria das Curvas e Superfícies	Singularidades	xxxx	E306	E306	12 cm x 12 cm x 28 cm	2,30000	R$ 100,00	LDM
P182		FALSE	TRUE	Puzzle 15 (Réplica)	Base em filamento impresso em 3D com peças quadrangulares numeradas de 1 a 15	Desenvolver o raciocínio lógico e introduzir a ideia de permutação par e ímpar	No quebra-cabeça de blocos deslizantes, as peças se movem apenas na vertical ou horizontal, não podem ser giradas e devem permanecer em contato com a base. O objetivo é ordenar novamente a sequência numérica	Permutação par/ímpar, jogos matemáticos, lógica, combinatória, puzzles deslizantes		https://drive.google.com/file/d/1Yj-ifZ7wgbHG37qSs23nCeIBCbAwvznd/view?usp=sharing		https://photos.app.goo.gl/pXtTBvmYwngakdB68		https://www.youtube.com/playlist?list=PLHiOaPPoa2tDL2bQMKJh9eEXyCw0i0Fkk	5	xxxx	Peça	Jogos e Quebra-Cabeças	Jogos e Quebra-Cabeças	xxxx	xxxx	xxxx	34 cm x 34 cm x 8 cm	2,30000	R$150,00	LDM
P183		FALSE	TRUE	Cubo Mágico de Rubik	Cubo de 3×3×3 com 6 faces coloridas	Resolver o cubo restaurando cada face para uma única cor	Girando suas camadas, o jogador embaralha e depois resolve com sequências de movimentos lógicos (algoritmos)	Permutação, grupos matemáticos, raciocínio lógico, visualização espacial, algoritmos		https://drive.google.com/file/d/153eiKpufOfxwMIWs5DzRbjJxmZ5GjiSE/view?usp=sharing		https://photos.app.goo.gl/1FdgPwYvdj1puTVN9		https://www.youtube.com/playlist?list=PLHiOaPPoa2tAoIV-XQK1lTBX_SjMQDGjU		xxxx	Peça	Jogos e Quebra-Cabeças	Jogos e Quebra-Cabeças	xxxx	E306	E306	5,7 cm x 5,7 cm x 5,7 cm	0,50000	R$ 20,00	LDM
P184		FALSE	TRUE	Tetraedro Mágico - Pyraminx	Quebra-cabeça em forma de tetraedro com faces triangulares coloridas	Resolver a pirâmide de modo que cada face tenha apenas uma cor	Rotacionando as camadas triangulares em torno dos vértices do tetraedro	Simetria, rotação de sólidos, combinatória, raciocínio lógico		https://drive.google.com/file/d/1wU4Q7GGBupCETsRxfmRV5g6fL9DdGgT5/view?usp=sharing		https://photos.app.goo.gl/iZR1Wo4eKESM2NcJ6		https://www.youtube.com/playlist?list=PLHiOaPPoa2tBmepXrH8hm7p0pa1t2vi1q		xxxx	Peça	Jogos e Quebra-Cabeças	Jogos e Quebra-Cabeças	xxxx	E306	E306	10 cm x 10 cm x 10 cm			LDM
P185		FALSE	TRUE	Dodecaedro Mágico - Megaminx	Quebra-cabeça em forma de dodecaedro com 12 faces pentagonais coloridas	Resolver de modo que cada face fique com apenas uma cor	Girando as camadas em torno dos centros das faces pentagonais, como no cubo mas com mais complexidade	Dodecaedro, combinatória, simetria, grupos matemáticos, raciocínio lógico		https://drive.google.com/file/d/1K9_m47WJIKi5XW4qs-Ad-kt5NCMMcpX5/view?usp=sharing		https://photos.app.goo.gl/kzg7u6zUU4KHKUe78		https://www.youtube.com/playlist?list=PLHiOaPPoa2tA0ALiWwZzXEVRwI6HmafGp		xxxx	Peça	Jogos e Quebra-Cabeças	Jogos e Quebra-Cabeças	xxxx	E306	E306	 cm x  cm x  cm			LDM
P186		FALSE	TRUE	Teorema de Pitágoras II (Quadrado) - Réplica 2	Base em filamento impresso em 3D com 8 jogos de quebra-cabeças coloridos	Observar que a área do quadrado maior é a soma das áreas dos dois quadrados menores, verificando o Teorema de Pitágoras	O visitante monta o quadrado maior com as peças escolhidas e, em seguida, reorganiza as mesmas peças para preencher os dois quadrados menores. Assim percebe que as áreas são equivalentes	Teorema de Pitágoras, áreas equivalentes, equidecomponibilidade, raciocínio espacial, demonstrações visuais		https://drive.google.com/file/d/1f69VVN6D8vfRLjG3VJjygCnF28nK8fhz/view?usp=sharing		https://photos.app.goo.gl/YXZpCrqq8dPjptJQ6		https://www.youtube.com/playlist?list=PLHiOaPPoa2tCl3q2CaOHav9ry41nmIZ_L		xxxx	Peça	Jogos Matemáticos	Jogos Matemáticos	xxxx	E306	E306	40 cm x 60 cm x 5 cm			LDM
P187		FALSE	TRUE	O Triângulo de Paul Curry - Réplica 2	Base em filamento impresso em 3D, acompanhando 4 peças com desenho quadriculado	Mostrar que a conclusão em matemática não pode se apoiar apenas em observações de figuras; destacar ilusões visuais e sofismas	O visitante deve montar um triângulo com as quatro peças. Em uma configuração, o triângulo parece perfeito; em outra, sobra um quadradinho. O efeito se deve à diferença de inclinação entre os triângulos componentes	Paradoxo geométrico, sofisma, equidecomponibilidade, sequência de Fibonacci, percepção visual		https://drive.google.com/file/d/1kC2dklf7ZNxq5XYMfjc-8NMangkZMm5w/view?usp=sharing		https://photos.app.goo.gl/e22FvaThbUVEmXit8		https://www.youtube.com/playlist?list=PLHiOaPPoa2tDwOp3krCGs_fiZz8dNlXLj	5	xxxx	Peça	Materiais Lúdicos	Materiais Lúdicos	xxxx	E306	E306	50 cm x 75 cm x 7 cm	5,40000	R$ 350,00	LDM
A001		FALSE	TRUE	De que Matemática estamos falando?	Este cartaz pretende apresentar, dentro de uma licença poética, uma ideia de como a matemática pode ser vista e compreendida	Trazer ao público escritos que reflitam a visão do que é a Matemática	São apresentados nos espaços expositivos	Matemática, Licença Poética		https://drive.google.com/file/d/1nuDkX8r2Ust0OKGOh_TseAdP36iQXkpS/view?usp=sharing		https://photos.app.goo.gl/43rzt6aPK5QbMEPHA		https://www.youtube.com/@matemativaDMA	5	xxxx	Material	Apresentação	Banner	xxxx	E040, EM03	E040, EM03	120 cm x 200 cm x 0,5 cm	5,40000	R$350,00	MUDI
A002		FALSE	TRUE	O Possível	Este cartaz pretende numa licença poética, uma ideia de como é possível apresentar a matemática colocando as fotos de todo o seu acervo	Trazer ao público escritos que reflitam a visão do que é a Matemática	São apresentados nos espaços expositivos	Matemática, Licença Poética		https://drive.google.com/file/d/1LAJTa9J3pVFTcT9sBGAf59Pu1dVC0tiI/view?usp=sharing		https://photos.app.goo.gl/43rzt6aPK5QbMEPHA		https://www.youtube.com/@matemativaDMA	4	xxxx	Material	Apresentação	Pôster 	xxxx	xxxx	xxxx	90 cm x 120 cm x 0,5 cm	4,00000	R$ 100,00	LDM
A003		FALSE	TRUE	Faixa de Evento	Uma faixa para identificar visualmente a exposição	Trazer ao público a informação do portal principal da exposição	São apresentados nos espaços expositivos de grande porte	Matemática, faixa de evento		https://drive.google.com/file/d/12uDc3er4ZQyEH_wDdPgaz3HI8EB8wcz_/view?usp=sharing		https://photos.app.goo.gl/43rzt6aPK5QbMEPHA		https://www.youtube.com/@matemativaDMA	5	xxxx	Material	Apresentação	Faixa	xxxx	xxxx	xxxx	400 cm x 70 cm x 0,5 cm	5,00000	R$200,00	LDM
A004		FALSE	TRUE	Banner de Evento	Este banner apresenta a exposição em seu estado de arte, com informações de seu acervo, contatos e apoios	Apresentar as informações básicas do projeto	São apresentados nos espaços expositivos	Matemática, exposição		https://drive.google.com/file/d/1MgBlG9ut6aWDp1YvKANJPfeSw8oPiLqv/view?usp=sharing		https://photos.app.goo.gl/43rzt6aPK5QbMEPHA		https://www.youtube.com/@matemativaDMA	5	xxxx	Material	Apresentação	Banner	xxxx	E306	E306	42 cm x 84 cm x 0,5 cm	1,00000	R$ 120,00	LDM
A005		FALSE	TRUE	Folder Geral de Evento	Folder de apresentação das principais informações sobre o projeto	Trazer ao público impressos que tragam clareza sobre a exposição apresentada	São disponibilizados nos espaços expositivos	Matemática, exposição		https://drive.google.com/file/d/1GdlnTT0pJAPeHZxzopBTU7hZilYRjtHx/view?usp=sharing		https://photos.app.goo.gl/43rzt6aPK5QbMEPHA		https://www.youtube.com/@matemativaDMA	5	xxxx	Material	Apresentação	Folder	xxxx	E306	E306	21 cm x 29,7 cm x 0,08 cm	0,05000	R$5,00	LDM
A006		FALSE	TRUE	De que Matemática estamos falando? - Réplica	Este cartaz pretende apresentar, dentro de uma licença poética, uma ideia de como a matemática pode ser vista e compreendida	Trazer ao público escritos que reflitam a visão do que é a Matemática	São apresentados nos espaços expositivos	Matemática, Licença Poética		https://drive.google.com/file/d/15ELPiV27kloU4SwaYzGHmxDzrcQjty_V/view?usp=sharing		https://photos.app.goo.gl/43rzt6aPK5QbMEPHA		https://www.youtube.com/@matemativaDMA	5	xxxx	Material	Apresentação	Pôster 	xxxx	xxxx	xxxx	110 cm x 111,42 cm x 0,5 cm	5,40000	R$ 350,00	MUDI
A007		FALSE	TRUE	Guia do Evento 007	É um guia para o visitante da exposição ocorrida no Evento 007	Trazer ao público impressos que tragam clareza sobre a exposição apresentada	São disponibilizados nos espaços expositivos	Matemática, exposição, guia		https://drive.google.com/file/d/1pgI4nFgFuf7v7flKCbpgIpZhB5y1PRA1/view?usp=sharing		https://photos.app.goo.gl/43rzt6aPK5QbMEPHA		https://www.youtube.com/@matemativaDMA	5	xxxx	Material	Apresentação	Guia	xxxx	xxxx	xxxx	14,85 cm x 21 cm x 0,08 cm	0,10000	R$5,00	LDM
A008		FALSE	TRUE	Página do Projeto	É um guia para o visitante da exposição ocorrida no Evento 007	Trazer ao público impressos que tragam clareza sobre a exposição apresentada	Basta acessar o endereço href https://matemativa.github.io/matemativa/index.html (matemativa.github.io/matemativa)	Matemática, exposição, homepage		https://drive.google.com/file/d/1rsDbIpV1d4EMbgZWZ79FN_WQdUAytoEE/view?usp=sharing		https://photos.app.goo.gl/43rzt6aPK5QbMEPHA		https://www.youtube.com/@matemativaDMA	4	xxxx	Material	Apresentação	Página	xxxx	xxxx	xxxx	1 cm x 1 cm x 1 cm	0,10000	R$ 1.000,00	LDM
A009		FALSE	TRUE	Guia para Monitores do MUDI	É um guia acervo exposto para os monitores do MUDI	Trazer ao monitor informações relevantes para a sua mediação	O monitor ao iniciar seus trabalhos no MUDI deverá acessar este guia como meio de treinamento da mediação	Matemática, exposição, guia, MUDI		https://drive.google.com/file/d/1yT7uBi1jPgpem3Fk8_njTozjgIOPfIkK/view?usp=sharing		https://photos.app.goo.gl/43rzt6aPK5QbMEPHA		https://www.youtube.com/@matemativaDMA	4	xxxx	Material	Apresentação	Guia	xxxx	xxxx	xxxx	14,85 cm x 21 cm x 0,08 cm	0,10000	R$10,00	LDM
A010		FALSE	TRUE	Barbante	Pedaço de barbante.	Servir de complemento para a respectiva peça.	Descrito na documentação da respectiva peça	barbante		https://drive.google.com/file/d/1-L9r8l5ZPXT8mYZKr7hvWeeW75hHPANJ/view?usp=sharing		https://photos.app.goo.gl/uh1XxieHiQmvPaS6A		https://www.youtube.com/@matemativaDMA	5	xxxx	Material	Acessórios	Material de Apoio	xxxx	E000; E001;E002;E007	E000; E001;E002;E007			R$ 5,00	LDM
A011		FALSE	TRUE	Régua	Régua comum de plástico	Servir de complemento para a respectiva peça.	Descrito na documentação da respectiva peça	régua, plástico		https://drive.google.com/file/d/1-L9r8l5ZPXT8mYZKr7hvWeeW75hHPANJ/view?usp=sharing		https://photos.app.goo.gl/uh1XxieHiQmvPaS6A		https://www.youtube.com/@matemativaDMA	5	xxxx	Material	Acessórios	Material de Apoio	xxxx	E000; E001;E002;E007	E000; E001;E002;E007			R$5,00	LDM
A012		FALSE	TRUE	Círculo de Madeira	Círculos de madeira MDF cortados em vários diâmetros	Servir de complemento para a respectiva peça.	Descrito na documentação da respectiva peça	mdf, círculo		https://drive.google.com/file/d/1-L9r8l5ZPXT8mYZKr7hvWeeW75hHPANJ/view?usp=sharing		https://photos.app.goo.gl/uh1XxieHiQmvPaS6A		https://www.youtube.com/@matemativaDMA	5	xxxx	Material	Acessórios	Material de Apoio	xxxx	E000; E001;E002;E007	E000; E001;E002;E007			R$ 50,00	LDM
A013		FALSE	TRUE	Pincel Atômico	Pincel atômico para quadro branco nas cores azul, preto, vermelho e verde	Servir de complemento para a respectiva peça.	Descrito na documentação da respectiva peça	pincel, quadro branco		https://drive.google.com/file/d/1-L9r8l5ZPXT8mYZKr7hvWeeW75hHPANJ/view?usp=sharing		https://photos.app.goo.gl/uh1XxieHiQmvPaS6A		https://www.youtube.com/@matemativaDMA	5	xxxx	Material	Acessórios	Material de Apoio	xxxx	E000; E001;E002;E007	E000; E001;E002;E007			R$6,00	LDM
A014		FALSE	TRUE	Apagador	Apagador para quadro branco	Servir de complemento para a respectiva peça.	Descrito na documentação da respectiva peça	apagador, quadro branco		https://drive.google.com/file/d/1-L9r8l5ZPXT8mYZKr7hvWeeW75hHPANJ/view?usp=sharing		https://photos.app.goo.gl/uh1XxieHiQmvPaS6A		https://www.youtube.com/@matemativaDMA	5	xxxx	Material	Acessórios	Material de Apoio	xxxx	E000; E001;E002;E007	E000; E001;E002;E007			R$ 4,00	LDM
A015		FALSE	TRUE	Lâmpada Pequena - 50 W - 110 V	Lãmpada de 50 W na tensão de 110 V	Servir de complemento para a respectiva peça.	Descrito na documentação da respectiva peça	lâmpada		https://drive.google.com/file/d/1-L9r8l5ZPXT8mYZKr7hvWeeW75hHPANJ/view?usp=sharing		https://photos.app.goo.gl/uh1XxieHiQmvPaS6A		https://www.youtube.com/@matemativaDMA	5	xxxx	Material	Acessórios	Material de Apoio	xxxx	xxxx	xxxx			R$15,00	LDM
A016		FALSE	TRUE	Tecido TNT Preto	Tecido de TNT na cor preto com centro vazado 	Servir de complemento para a respectiva peça.	Descrito na documentação da respectiva peça	tnt		https://drive.google.com/file/d/1-L9r8l5ZPXT8mYZKr7hvWeeW75hHPANJ/view?usp=sharing		https://photos.app.goo.gl/uh1XxieHiQmvPaS6A		https://www.youtube.com/@matemativaDMA	5	xxxx	Material	Acessórios	Material de Apoio	xxxx	xxxx	xxxx			R$ 10,00	LDM
A017		FALSE	TRUE	Cabo de Energia Elétrica	Extensão elétrica para alcançar tomadas	Servir de complemento para a respectiva peça.	Descrito na documentação da respectiva peça	extensão elétrica		https://drive.google.com/file/d/1-L9r8l5ZPXT8mYZKr7hvWeeW75hHPANJ/view?usp=sharing		https://photos.app.goo.gl/uh1XxieHiQmvPaS6A		https://www.youtube.com/@matemativaDMA	5	xxxx	Material	Acessórios	Material de Apoio	xxxx	xxxx	xxxx			R$25,00	LDM
A018		FALSE	TRUE	Caneta Laser	Caneta laser da cor verde	Servir de complemento para a respectiva peça.	Descrito na documentação da respectiva peça	caneta laser		https://drive.google.com/file/d/1-L9r8l5ZPXT8mYZKr7hvWeeW75hHPANJ/view?usp=sharing		https://photos.app.goo.gl/uh1XxieHiQmvPaS6A		https://www.youtube.com/@matemativaDMA	5	xxxx	Material	Acessórios	Material de Apoio	xxxx	xxxx	xxxx			R$ 60,00	LDM
A019		FALSE	TRUE	Cilindro de Vidro Transparente	Cilindro de vidro utilizado em laboratório de química 	Servir de complemento para a respectiva peça.	Descrito na documentação da respectiva peça	vidro, cilindro		https://drive.google.com/file/d/1-L9r8l5ZPXT8mYZKr7hvWeeW75hHPANJ/view?usp=sharing		https://photos.app.goo.gl/uh1XxieHiQmvPaS6A		https://www.youtube.com/@matemativaDMA	5	xxxx	Material	Acessórios	Material de Apoio	xxxx	xxxx	xxxx			R$20,00	LDM
A020		FALSE	TRUE	Recipiente de Plástico	Caixa de acrílico para colocar água	Servir de complemento para a respectiva peça.	Descrito na documentação da respectiva peça	caixa, plástico, acrílico		https://drive.google.com/file/d/1-L9r8l5ZPXT8mYZKr7hvWeeW75hHPANJ/view?usp=sharing		https://photos.app.goo.gl/uh1XxieHiQmvPaS6A		https://www.youtube.com/@matemativaDMA	5	xxxx	Material	Acessórios	Material de Apoio	xxxx	xxxx	xxxx			R$ 80,00	LDM
A021		FALSE	TRUE	Tintura para Água	Tintura solúvel em água	Servir de complemento para a respectiva peça.	Descrito na documentação da respectiva peça	tintura		https://drive.google.com/file/d/1-L9r8l5ZPXT8mYZKr7hvWeeW75hHPANJ/view?usp=sharing		https://photos.app.goo.gl/uh1XxieHiQmvPaS6A		https://www.youtube.com/@matemativaDMA	5	xxxx	Material	Acessórios	Material de Apoio	xxxx	xxxx	xxxx			R$2,00	LDM
A022		FALSE	TRUE	Cilindro de Silicone	Cilindro de silicone do tipo refil para cola quente	Servir de complemento para a respectiva peça.	Descrito na documentação da respectiva peça	silicone, cilindro		https://drive.google.com/file/d/1-L9r8l5ZPXT8mYZKr7hvWeeW75hHPANJ/view?usp=sharing		https://photos.app.goo.gl/uh1XxieHiQmvPaS6A		https://www.youtube.com/@matemativaDMA	5	xxxx	Material	Acessórios	Material de Apoio	xxxx	xxxx	xxxx			R$ 3,00	LDM
A023		FALSE	TRUE	Fósforo	Caixa de fósforo na cor marrom	Servir de complemento para a respectiva peça.	Descrito na documentação da respectiva peça	fósforo		https://drive.google.com/file/d/1-L9r8l5ZPXT8mYZKr7hvWeeW75hHPANJ/view?usp=sharing		https://photos.app.goo.gl/uh1XxieHiQmvPaS6A		https://www.youtube.com/@matemativaDMA	5	xxxx	Material	Acessórios	Material de Apoio	xxxx	xxxx	xxxx			R$2,00	LDM
A024		FALSE	TRUE	Pedaço de Madeira Escuro	Pedaço de maneira numa cor escuro para refletir pouca luz	Servir de complemento para a respectiva peça.	Descrito na documentação da respectiva peça	madeira		https://drive.google.com/file/d/1-L9r8l5ZPXT8mYZKr7hvWeeW75hHPANJ/view?usp=sharing		https://photos.app.goo.gl/uh1XxieHiQmvPaS6A		https://www.youtube.com/@matemativaDMA	5	xxxx	Material	Acessórios	Material de Apoio	xxxx	xxxx	xxxx			R$ 2,00	LDM
A025		FALSE	TRUE	Taco de Golfe	Taco de golfe em madeira	Servir de complemento para a respectiva peça.	Descrito na documentação da respectiva peça	taco, golfe		https://drive.google.com/file/d/1-L9r8l5ZPXT8mYZKr7hvWeeW75hHPANJ/view?usp=sharing		https://photos.app.goo.gl/uh1XxieHiQmvPaS6A		https://www.youtube.com/@matemativaDMA	5	xxxx	Material	Acessórios	Material de Apoio	xxxx	xxxx	xxxx			R$80,00	LDM
A026		FALSE	TRUE	Bolinha de Golfe	Bolinha de golfe	Servir de complemento para a respectiva peça.	Descrito na documentação da respectiva peça	bola, golfe		https://drive.google.com/file/d/1-L9r8l5ZPXT8mYZKr7hvWeeW75hHPANJ/view?usp=sharing		https://photos.app.goo.gl/uh1XxieHiQmvPaS6A		https://www.youtube.com/@matemativaDMA	5	xxxx	Material	Acessórios	Material de Apoio	xxxx	xxxx	xxxx			R$ 50,00	LDM
A027		FALSE	TRUE	Taco de Bilhar	Taco de bilhar de madeira	Servir de complemento para a respectiva peça.	Descrito na documentação da respectiva peça	taco, bilhar		https://drive.google.com/file/d/1-L9r8l5ZPXT8mYZKr7hvWeeW75hHPANJ/view?usp=sharing		https://photos.app.goo.gl/uh1XxieHiQmvPaS6A		https://www.youtube.com/@matemativaDMA	5	xxxx	Material	Acessórios	Material de Apoio	xxxx	xxxx	xxxx			R$50,00	LDM
A028		FALSE	TRUE	Bolinha de Bilhar	Bolinha de mini bilhar	Servir de complemento para a respectiva peça.	Descrito na documentação da respectiva peça	bola, minibilhar		https://drive.google.com/file/d/1-L9r8l5ZPXT8mYZKr7hvWeeW75hHPANJ/view?usp=sharing		https://photos.app.goo.gl/uh1XxieHiQmvPaS6A		https://www.youtube.com/@matemativaDMA	5	xxxx	Material	Acessórios	Material de Apoio	xxxx	xxxx	xxxx			R$ 40,00	LDM
A029		FALSE	TRUE	Imã	Imã grande do tipo anel	Servir de complemento para a respectiva peça.	Descrito na documentação da respectiva peça	imã		https://drive.google.com/file/d/1-L9r8l5ZPXT8mYZKr7hvWeeW75hHPANJ/view?usp=sharing		https://photos.app.goo.gl/uh1XxieHiQmvPaS6A		https://www.youtube.com/@matemativaDMA	5	xxxx	Material	Acessórios	Material de Apoio	xxxx	xxxx	xxxx			R$45,00	LDM
A030		FALSE	TRUE	Elástico	Elásticos  comuns	Servir de complemento para a respectiva peça.	Descrito na documentação da respectiva peça	elástico		https://drive.google.com/file/d/1-L9r8l5ZPXT8mYZKr7hvWeeW75hHPANJ/view?usp=sharing		https://photos.app.goo.gl/uh1XxieHiQmvPaS6A		https://www.youtube.com/@matemativaDMA	5	xxxx	Material	Acessórios	Material de Apoio	xxxx	xxxx	xxxx			R$ 10,00	LDM
A031		FALSE	TRUE	Computador	Computador, notebook ou tablet para uso em softwares e aplicativos.	Servir de complemento para a respectiva peça.	Descrito na documentação da respectiva peça	computador, pc, tablet, smarttphone		https://drive.google.com/file/d/1-L9r8l5ZPXT8mYZKr7hvWeeW75hHPANJ/view?usp=sharing		https://photos.app.goo.gl/uh1XxieHiQmvPaS6A		https://www.youtube.com/@matemativaDMA	5	xxxx	Material	Acessórios	Material de Apoio	xxxx	xxxx	xxxx			R$2.000,00	LDM
A032		FALSE	TRUE	Pilha AA	Par de pilhas AA	Servir de complemento para a respectiva peça.	Descrito na documentação da respectiva peça	pilhas		https://drive.google.com/file/d/1-L9r8l5ZPXT8mYZKr7hvWeeW75hHPANJ/view?usp=sharing		https://photos.app.goo.gl/uh1XxieHiQmvPaS6A		https://www.youtube.com/@matemativaDMA	5	xxxx	Material	Acessórios	Material de Apoio	xxxx	xxxx	xxxx			R$ 5,00	LDM
A033		FALSE	TRUE	Displays do Evento 000	Texto contendo todos os displays do Evento 000	Auxliar na comprensão da filosofia do projeto e, mais espeficamente, no entendimento do funcionamento de cada uma das peças 	Disponível para leitura em PDF através de QR-code ou, quando possível, impresso em papel	display		https://drive.google.com/file/d/1R-fv0pmzUgXHVLcbzuXqqkREk-I_yQPN/view?usp=sharing		https://photos.app.goo.gl/43rzt6aPK5QbMEPHA		https://www.youtube.com/@matemativaDMA	5	xxxx	Material	Apresentação	Displays	xxxx	E000	E000	14,85 cm x 21 cm x 0,08 cm	0,05000	R$5,00	LDM
A034		FALSE	TRUE	Figuras Impressas em MDF	Conjunto de figuras adesivadas em MDF no formato da câmara quadrada	Servir de complemento para a respectiva peça.	Descrito na documentação da respectiva peça	mdf, figuras, simetria		https://drive.google.com/file/d/1-L9r8l5ZPXT8mYZKr7hvWeeW75hHPANJ/view?usp=sharing		https://photos.app.goo.gl/uh1XxieHiQmvPaS6A		https://www.youtube.com/@matemativaDMA	5	xxxx	Material	Acessórios	Material de Apoio	xxxx	xxxx	xxxx			R$ 150,00	LDM
A035		FALSE	TRUE	Base de Madeira para Crianças	Base de madeira para ser colocada na parte interna da Cabine do Infinito	Servir de complemento para a respectiva peça.	Descrito na documentação da respectiva peça	base, madeira		https://drive.google.com/file/d/1-L9r8l5ZPXT8mYZKr7hvWeeW75hHPANJ/view?usp=sharing		https://photos.app.goo.gl/uh1XxieHiQmvPaS6A		https://www.youtube.com/@matemativaDMA	5	xxxx	Material	Acessórios	Material de Apoio	xxxx	xxxx	xxxx			R$50,00	LDM
A036		FALSE	TRUE	Figuras Impressas em Papel Foto	Conjunto de figuras impressas em papel foto  descrevendo todos os tipos de simetrias planas	Servir de complemento para a respectiva peça.	Descrito na documentação da respectiva peça	papel foto, simetria		https://drive.google.com/file/d/1-L9r8l5ZPXT8mYZKr7hvWeeW75hHPANJ/view?usp=sharing		https://photos.app.goo.gl/uh1XxieHiQmvPaS6A		https://www.youtube.com/@matemativaDMA	5	xxxx	Material	Acessórios	Material de Apoio	xxxx	xxxx	xxxx			R$ 80,00	LDM
A037		FALSE	TRUE	Objetos Iguais	Um par de objetos iguais, por exemplo, duas bonecas pequenas para ser utilizada no Quarto de Ames	Servir de complemento para a respectiva peça.	Descrito na documentação da respectiva peça	bonequinhas 		https://drive.google.com/file/d/1-L9r8l5ZPXT8mYZKr7hvWeeW75hHPANJ/view?usp=sharing		https://photos.app.goo.gl/uh1XxieHiQmvPaS6A		https://www.youtube.com/@matemativaDMA	5	xxxx	Material	Acessórios	Material de Apoio	xxxx	xxxx	xxxx			R$20,00	LDM
A038		FALSE	TRUE	Lâmpada Incandescente - 300 W - 110V	Lâmpada de 300 W incandescente com tensão de 110 V.	Servir de complemento para a respectiva peça.	Descrito na documentação da respectiva peça	lâmpada incandescente		https://drive.google.com/file/d/1-L9r8l5ZPXT8mYZKr7hvWeeW75hHPANJ/view?usp=sharing		https://photos.app.goo.gl/uh1XxieHiQmvPaS6A		https://www.youtube.com/@matemativaDMA	5	xxxx	Material	Acessórios	Material de Apoio	xxxx	xxxx	xxxx			R$ 30,00	LDM
A039		FALSE	TRUE	Bolinhas Pequenas	Bolinhas pequenas iguais a que eram utilizadas em antigos mouses.	Servir de complemento para a respectiva peça.	Descrito na documentação da respectiva peça	bola pequena		https://drive.google.com/file/d/1-L9r8l5ZPXT8mYZKr7hvWeeW75hHPANJ/view?usp=sharing		https://photos.app.goo.gl/uh1XxieHiQmvPaS6A		https://www.youtube.com/@matemativaDMA	5	xxxx	Material	Acessórios	Material de Apoio	xxxx	xxxx	xxxx			R$5,00	LDM
